<?xml version="1.0" encoding="UTF-8"?>
<tns:ConsultaInfoCuentaResponse xmlns:tns="http://www.banorte.com/ws/esb/ConsultaInfoResponse" xmlns:xsi="http://www.w3.org/2001/XMLSchema-instance" xsi:schemaLocation="http://www.banorte.com/ws/esb/ConsultaInfoResponse ConsultaInfoResponse.xsd ">
  <tns:Bgm1621>
    <tns:FechaProceso>0</tns:FechaProceso>
    <tns:NumeroCuenta>tns:NumeroCuenta</tns:NumeroCuenta>
    <tns:ClabeCuenta>tns:ClabeCuenta</tns:ClabeCuenta>
    <tns:CR>tns:CR</tns:CR>
    <tns:DescripcionSucursal>tns:DescripcionSucursal</tns:DescripcionSucursal>
    <tns:SaldoInicial>0.0</tns:SaldoInicial>
    <tns:TipoDivisa>tns:TipoDivisa</tns:TipoDivisa>
    <tns:SaldoDisponible>0.0</tns:SaldoDisponible>
    <tns:SaldoRetenido>0.0</tns:SaldoRetenido>
    <tns:SaldoDia>0.0</tns:SaldoDia>
    <tns:RegimenFirmas>tns:RegimenFirmas</tns:RegimenFirmas>
    <tns:NombrePromotor>tns:NombrePromotor</tns:NombrePromotor>
  </tns:Bgm1621>
  <tns:Bgm1622>
    <tns:FechaProceso>0</tns:FechaProceso>
    <tns:NumeroCuenta>tns:NumeroCuenta</tns:NumeroCuenta>
    <tns:CuentaAsociada>tns:CuentaAsociada</tns:CuentaAsociada>
    <tns:NumeroCliente>tns:NumeroCliente</tns:NumeroCliente>
    <tns:NombreCliente>tns:NombreCliente</tns:NombreCliente>
    <tns:RFC>tns:RFC</tns:RFC>
    <tns:NombreCalle>tns:NombreCalle</tns:NombreCalle>
    <tns:Numero>tns:Numero</tns:Numero>
    <tns:NombreColonia>tns:NombreColonia</tns:NombreColonia>
    <tns:EntidadFederativa>tns:EntidadFederativa</tns:EntidadFederativa>
    <tns:NombreCiudad>tns:NombreCiudad</tns:NombreCiudad>
    <tns:CodigoPostal>tns:CodigoPostal</tns:CodigoPostal>
    <tns:Telefono>tns:Telefono</tns:Telefono>
    <tns:TipoProducto>tns:TipoProducto</tns:TipoProducto>
    <tns:SubProducto>tns:SubProducto</tns:SubProducto>
    <tns:DescSubProducto>tns:DescSubProducto</tns:DescSubProducto>
    <tns:StatusCuenta>tns:StatusCuenta</tns:StatusCuenta>
    <tns:CR>tns:CR</tns:CR>
    <tns:DescSucursal>tns:DescSucursal</tns:DescSucursal>
    <tns:FechaApertura>0</tns:FechaApertura>
    <tns:FechaVencimiento>0</tns:FechaVencimiento>
    <tns:TipoDivisa>tns:TipoDivisa</tns:TipoDivisa>
    <tns:CuentaClabe>tns:CuentaClabe</tns:CuentaClabe>
    <tns:SaldoPromedio>0.0</tns:SaldoPromedio>
    <tns:CodigoRetencion>tns:CodigoRetencion</tns:CodigoRetencion>
    <tns:Regimen>tns:Regimen</tns:Regimen>
    <tns:SusceptibilidadPlast>tns:SusceptibilidadPlast</tns:SusceptibilidadPlast>
    <tns:Titularidad>tns:Titularidad</tns:Titularidad>
    <tns:Claveregimen>tns:Claveregimen</tns:Claveregimen>
    <tns:CodigoBloqueo>tns:CodigoBloqueo</tns:CodigoBloqueo>
    <tns:SituacionCuenta>tns:SituacionCuenta</tns:SituacionCuenta>
    <tns:BloqueoJudicial>tns:BloqueoJudicial</tns:BloqueoJudicial>
    <tns:BloqueoAdmon>tns:BloqueoAdmon</tns:BloqueoAdmon>
    <tns:LiquidacionInte>tns:LiquidacionInte</tns:LiquidacionInte>
    <tns:LineaPrivilegios>tns:LineaPrivilegios</tns:LineaPrivilegios>
    <tns:MontoServicio>0.0</tns:MontoServicio>
    <tns:EstatusLinPriv>0</tns:EstatusLinPriv>
    <tns:IndServicio>tns:IndServicio</tns:IndServicio>
    <tns:IndComision>tns:IndComision</tns:IndComision>
    <tns:RegimenFirmas>tns:RegimenFirmas</tns:RegimenFirmas>
    <tns:NombrePromotor>tns:NombrePromotor</tns:NombrePromotor>
  </tns:Bgm1622>
  <tns:Bgm1623>
    <tns:FechaProceso>0</tns:FechaProceso>
    <tns:NumeroCuenta>tns:NumeroCuenta</tns:NumeroCuenta>
    <tns:ClabeCuenta>tns:ClabeCuenta</tns:ClabeCuenta>
    <tns:CR>tns:CR</tns:CR>
    <tns:DescripcionSucursal>tns:DescripcionSucursal</tns:DescripcionSucursal>
    <tns:SaldoInicial>0.0</tns:SaldoInicial>
    <tns:TipoDivisa>tns:TipoDivisa</tns:TipoDivisa>
    <tns:SaldoDisponible>0.0</tns:SaldoDisponible>
    <tns:SaldoRetenido>0.0</tns:SaldoRetenido>
    <tns:SaldoDia>0.0</tns:SaldoDia>
    <tns:SaldoMesAnterior>tns:SaldoMesAnterior</tns:SaldoMesAnterior>
    <tns:RegimenFirmas>tns:RegimenFirmas</tns:RegimenFirmas>
  </tns:Bgm1623>
  <tns:Bgm1624>
    <tns:DescripcionBloqueo>tns:DescripcionBloqueo</tns:DescripcionBloqueo>
  </tns:Bgm1624>
  <tns:Bgm1625>
    <tns:Titulo1>tns:Titulo1</tns:Titulo1>
  </tns:Bgm1625>
  <tns:Bgm1626>
    <tns:FecFinM>tns:FecFinM</tns:FecFinM>
    <tns:Saldo>tns:Saldo</tns:Saldo>
  </tns:Bgm1626>
</tns:ConsultaInfoCuentaResponse>
